{
  "new_account_maltainvest": 1,
  "salutation": "Mr",
  "first_name": "Captain",
  "last_name": "Hook",
  "date_of_birth": "1980-01-31",
  "residence": "be",
  "address_line_1": "20 Broadway Av",
  "address_line_2": "East Melbourne VIC",
  "address_city": "Melbourne",
  "address_state": "Victoria",
  "address_postcode": "3002",
  "phone": "+6123456789",
  "secret_question": "Mother's maiden name",
  "secret_answer": "Jones",
  "forex_trading_experience": "Over 3 years",
  "forex_trading_frequency": "0-5 transactions in the past 12 months",
  "indices_trading_experience": "1-2 years",
  "indices_trading_frequency": "40 transactions or more in the past 12 months",
  "commodities_trading_experience": "1-2 years",
  "commodities_trading_frequency": "0-5 transactions in the past 12 months",
  "stocks_trading_experience": "1-2 years",
  "stocks_trading_frequency": "0-5 transactions in the past 12 months",
  "other_derivatives_trading_experience": "Over 3 years",
  "other_derivatives_trading_frequency": "0-5 transactions in the past 12 months",
  "other_instruments_trading_experience": "Over 3 years",
  "other_instruments_trading_frequency": "6-10 transactions in the past 12 months",
  "employment_industry": "Finance",
  "education_level": "Secondary",
  "income_source": "Self-Employed",
  "net_income": "$25,000 - $50,000",
  "estimated_worth": "$100,000 - $250,000",
  "accept_risk": 1
}
